{
  "schema_version": "0.1",
  "observation_id": "OBS-GEMINI105MC-BOARDSTATE-001",
  "research_target": {
    "manufacturer": "Performance Cruising",
    "model": "Gemini 105Mc",
    "first_built": 1994
  },
  "source_id": "SRC-GEMINI105MC-MANUAL",
  "source_locator": {
    "page": null,
    "section": null,
    "anchor": null,
    "table": null,
    "figure": null,
    "record_key": null
  },
  "observation": {
    "raw": {
      "kind": "text_fragment",
      "value": "leeward board only deployed — standard sailing procedure in certain conditions",
      "unit": null,
      "excerpt": "Legitimate sailing procedure: both boards, leeward-only board, or no boards deployed depending on conditions"
    },
    "normalized_candidate": null
  },
  "evidence_type": "manufacturer_specification",
  "claim_semantics": "operating_state_value",
  "applicability": {
    "schema_version": "0.1",
    "first_year": null,
    "last_year": null,
    "hull_number_from": null,
    "hull_number_to": null,
    "market_or_region": null,
    "named_variant_hint": null,
    "design_option_hints": null,
    "operating_state_hint": "leeward_board_only_deployed",
    "individual_hull_or_listing_ref": null,
    "unknown_or_unbounded": false
  },
  "producer": {
    "kind": "llm",
    "identifier": "benchmark-research-agent",
    "version": "0.1",
    "model": "claude-sonnet-4-6",
    "prompt_or_rule_version": "slice-0012-benchmark"
  },
  "research_context": {
    "research_job_id": "JOB-GEMINI105MC-001",
    "activity_id": "WAVE-06"
  },
  "observed_at": "2026-08-20T10:00:00Z",
  "confidence": "high",
  "supersedes_observation_id": null,
  "intended_subject_kind_hint": "boat_design",
  "intended_field_pointer": null,
  "notes": "Gemini 105Mc centerboard deployment state — operating_state_value, no DesignOption ID invented. B06-007 Wave 06: installed appendage count (one board per hull) differs from deployed-state count. Design has one pivoting centerboard per hull; operating state specifies how many and which boards are deployed."
}
