{
  "schema_version": "0.1",
  "observation_id": "SYNTHETIC-OBS-BAVARIA38-BROKER-DISP-001",
  "research_target": {
    "manufacturer": "Bavaria Yachtbau",
    "model": "Bavaria 38",
    "first_built": 1999
  },
  "source_id": "SYNTHETIC-SRC-BROKER-LISTING-REF",
  "source_locator": {
    "page": null,
    "section": null,
    "anchor": null,
    "table": null,
    "figure": null,
    "record_key": "LISTING-2024-DE-001"
  },
  "observation": {
    "raw": {
      "kind": "text_fragment",
      "value": "displacement as stated by seller — individual hull figure [synthetic fixture value]",
      "unit": null,
      "excerpt": "Displacement stated by seller (individual hull) [synthetic fixture — value not retained from benchmark research]"
    },
    "normalized_candidate": null
  },
  "evidence_type": "narrative_text",
  "claim_semantics": "individual_hull_value",
  "applicability": {
    "schema_version": "0.1",
    "first_year": null,
    "last_year": null,
    "hull_number_from": null,
    "hull_number_to": null,
    "market_or_region": "DE",
    "named_variant_hint": null,
    "design_option_hints": null,
    "operating_state_hint": null,
    "individual_hull_or_listing_ref": "LISTING-2024-DE-001",
    "unknown_or_unbounded": false
  },
  "producer": {
    "kind": "deterministic_tool",
    "identifier": "slice-0012-fixture-builder",
    "version": "0.1",
    "model": null,
    "prompt_or_rule_version": "slice-0012-fixture-v1"
  },
  "research_context": {
    "research_job_id": "SYNTHETIC-JOB-BAVARIA38-001",
    "activity_id": "WAVE-06"
  },
  "observed_at": "2026-08-20T00:00:00Z",
  "confidence": "low",
  "supersedes_observation_id": null,
  "intended_subject_kind_hint": null,
  "intended_field_pointer": null,
  "notes": "BENCHMARK CONCEPT: B06-009 Wave 06 — individual_hull_value from a broker listing must not project to BoatDesign baseline; Bavaria 38 has keel-configuration-dependent mass. SYNTHETIC SCAFFOLDING: all observation values, observation_id, source_id, listing ref, research_job_id, producer, and observed_at are synthetic contract fixture metadata, not retained benchmark provenance."
}
